[
  {
    "anchor": "unfccc-ccnucc",
    "id": "S-0001",
    "level": 1,
    "provenance": {
      "source_hash": "30cabf0faee1d8a6ee4b147698d0e11aa2a5fd7530c29cb0393ea8be4a48afa0",
      "source_ref": "UNFCCC/AMS-III.D@v21-0"
    },
    "title": "UNFCCC/CCNUCC"
  },
  {
    "anchor": "july-2006",
    "id": "S-0002",
    "level": 1,
    "provenance": {
      "source_hash": "30cabf0faee1d8a6ee4b147698d0e11aa2a5fd7530c29cb0393ea8be4a48afa0",
      "source_ref": "UNFCCC/AMS-III.D@v21-0"
    },
    "title": "July 2006"
  },
  {
    "anchor": "type-iii-other-project-activities",
    "id": "S-0003",
    "level": 1,
    "provenance": {
      "source_hash": "30cabf0faee1d8a6ee4b147698d0e11aa2a5fd7530c29cb0393ea8be4a48afa0",
      "source_ref": "UNFCCC/AMS-III.D@v21-0"
    },
    "title": "TYPE III - OTHER PROJECT ACTIVITIES"
  },
  {
    "anchor": "this-project-category-comprises-methane-recovery-from-manure-and-wastes-from-agricultural-or",
    "id": "S-0004",
    "level": 1,
    "provenance": {
      "source_hash": "30cabf0faee1d8a6ee4b147698d0e11aa2a5fd7530c29cb0393ea8be4a48afa0",
      "source_ref": "UNFCCC/AMS-III.D@v21-0"
    },
    "title": "This project category comprises methane recovery from manure and wastes from agricultural or"
  },
  {
    "anchor": "projects-that-recover-methane-from-landfills-shall-use-category-iii-g-and-projects-for-wastewater",
    "id": "S-0005",
    "level": 1,
    "provenance": {
      "source_hash": "30cabf0faee1d8a6ee4b147698d0e11aa2a5fd7530c29cb0393ea8be4a48afa0",
      "source_ref": "UNFCCC/AMS-III.D@v21-0"
    },
    "title": "Projects that recover methane from landfills shall use category III-G and projects for wastewater"
  },
  {
    "anchor": "this-category-is-applicable-for-project-activities-resulting-in-annual-emission-reductions-lower-than",
    "id": "S-0006",
    "level": 1,
    "provenance": {
      "source_hash": "30cabf0faee1d8a6ee4b147698d0e11aa2a5fd7530c29cb0393ea8be4a48afa0",
      "source_ref": "UNFCCC/AMS-III.D@v21-0"
    },
    "title": "This category is applicable for project activities resulting in annual emission reductions lower than"
  },
  {
    "anchor": "the-project-boundary-is-the-physical-geographical-site-of-the-methane-recovery-facility",
    "id": "S-0007",
    "level": 1,
    "provenance": {
      "source_hash": "30cabf0faee1d8a6ee4b147698d0e11aa2a5fd7530c29cb0393ea8be4a48afa0",
      "source_ref": "UNFCCC/AMS-III.D@v21-0"
    },
    "title": "The project boundary is the physical, geographical site of the methane recovery facility."
  },
  {
    "anchor": "project-activities-are-eligible-under-this-category-if-they-directly-emit-less-than-15-kilo-tonnes-of",
    "id": "S-0008",
    "level": 1,
    "provenance": {
      "source_hash": "30cabf0faee1d8a6ee4b147698d0e11aa2a5fd7530c29cb0393ea8be4a48afa0",
      "source_ref": "UNFCCC/AMS-III.D@v21-0"
    },
    "title": "Project activities are eligible under this category if they directly emit less than 15 kilo tonnes of"
  },
  {
    "anchor": "technical-measures-shall-be-used-e-g-flared-combusted-to-ensure-that-all-biogas-produced-by",
    "id": "S-0009",
    "level": 1,
    "provenance": {
      "source_hash": "30cabf0faee1d8a6ee4b147698d0e11aa2a5fd7530c29cb0393ea8be4a48afa0",
      "source_ref": "UNFCCC/AMS-III.D@v21-0"
    },
    "title": "Technical measures shall be used (e.g. flared, combusted) to ensure that all biogas produced by"
  },
  {
    "anchor": "unfccc-ccnucc-2",
    "id": "S-0010",
    "level": 1,
    "provenance": {
      "source_hash": "30cabf0faee1d8a6ee4b147698d0e11aa2a5fd7530c29cb0393ea8be4a48afa0",
      "source_ref": "UNFCCC/AMS-III.D@v21-0"
    },
    "title": "UNFCCC/CCNUCC"
  },
  {
    "anchor": "july-2006-2",
    "id": "S-0011",
    "level": 1,
    "provenance": {
      "source_hash": "30cabf0faee1d8a6ee4b147698d0e11aa2a5fd7530c29cb0393ea8be4a48afa0",
      "source_ref": "UNFCCC/AMS-III.D@v21-0"
    },
    "title": "July 2006"
  },
  {
    "anchor": "the-emission-baseline-is-the-amount-of-methane-that-would-be-emitted-to-the-atmosphere-during",
    "id": "S-0012",
    "level": 1,
    "provenance": {
      "source_hash": "30cabf0faee1d8a6ee4b147698d0e11aa2a5fd7530c29cb0393ea8be4a48afa0",
      "source_ref": "UNFCCC/AMS-III.D@v21-0"
    },
    "title": "The emission baseline is the amount of methane that would be emitted to the atmosphere during"
  },
  {
    "anchor": "if-the-recovered-methane-is-used-for-heat-or-electricity-generation-it-can-apply-to-the",
    "id": "S-0013",
    "level": 1,
    "provenance": {
      "source_hash": "30cabf0faee1d8a6ee4b147698d0e11aa2a5fd7530c29cb0393ea8be4a48afa0",
      "source_ref": "UNFCCC/AMS-III.D@v21-0"
    },
    "title": "If the recovered methane is used for heat or electricity generation it can apply to the"
  },
  {
    "anchor": "no-leakage-calculation-is-required",
    "id": "S-0014",
    "level": 1,
    "provenance": {
      "source_hash": "30cabf0faee1d8a6ee4b147698d0e11aa2a5fd7530c29cb0393ea8be4a48afa0",
      "source_ref": "UNFCCC/AMS-III.D@v21-0"
    },
    "title": "No leakage calculation is required"
  },
  {
    "anchor": "the-amount-of-methane-used-as-fuel-or-combusted-shall-be-monitored-using-flow-meters-and",
    "id": "S-0015",
    "level": 1,
    "provenance": {
      "source_hash": "30cabf0faee1d8a6ee4b147698d0e11aa2a5fd7530c29cb0393ea8be4a48afa0",
      "source_ref": "UNFCCC/AMS-III.D@v21-0"
    },
    "title": "The amount of methane used as fuel or combusted shall be monitored, using flow meters and"
  },
  {
    "anchor": "regular-maintenance-should-ensure-optimal-operation-of-flares-the-flare-efficiency-defined-as",
    "id": "S-0016",
    "level": 1,
    "provenance": {
      "source_hash": "30cabf0faee1d8a6ee4b147698d0e11aa2a5fd7530c29cb0393ea8be4a48afa0",
      "source_ref": "UNFCCC/AMS-III.D@v21-0"
    },
    "title": "Regular maintenance should ensure optimal operation of flares. The flare efficiency, defined as"
  },
  {
    "anchor": "flow-meters-sampling-devices-and-gas-analysers-shall-be-subject-to-regular-maintenance-testing",
    "id": "S-0017",
    "level": 1,
    "provenance": {
      "source_hash": "30cabf0faee1d8a6ee4b147698d0e11aa2a5fd7530c29cb0393ea8be4a48afa0",
      "source_ref": "UNFCCC/AMS-III.D@v21-0"
    },
    "title": "Flow meters, sampling devices and gas analysers shall be subject to regular maintenance, testing"
  }
]
