[
  {
    "anchor": "unfccc-ccnucc",
    "id": "S-0001",
    "level": 1,
    "provenance": {
      "source_hash": "2ba84bf061fa6ac81436dc6fa05308bedaedb75f819183d985932ea587a71098",
      "source_ref": "UNFCCC/AMS-III.D@v21-0"
    },
    "title": "UNFCCC/CCNUCC"
  },
  {
    "anchor": "eb-33",
    "id": "S-0002",
    "level": 1,
    "provenance": {
      "source_hash": "2ba84bf061fa6ac81436dc6fa05308bedaedb75f819183d985932ea587a71098",
      "source_ref": "UNFCCC/AMS-III.D@v21-0"
    },
    "title": "EB 33"
  },
  {
    "anchor": "type-iii-other-project-activities",
    "id": "S-0003",
    "level": 1,
    "provenance": {
      "source_hash": "2ba84bf061fa6ac81436dc6fa05308bedaedb75f819183d985932ea587a71098",
      "source_ref": "UNFCCC/AMS-III.D@v21-0"
    },
    "title": "TYPE III - OTHER PROJECT ACTIVITIES"
  },
  {
    "anchor": "this-project-category-comprises-methane-recovery-and-destruction-from-manure-and-wastes",
    "id": "S-0004",
    "level": 1,
    "provenance": {
      "source_hash": "2ba84bf061fa6ac81436dc6fa05308bedaedb75f819183d985932ea587a71098",
      "source_ref": "UNFCCC/AMS-III.D@v21-0"
    },
    "title": "This project category comprises methane recovery and destruction from manure and wastes"
  },
  {
    "anchor": "the-project-activity-shall-satisfy-the-following-conditions",
    "id": "S-0005",
    "level": 1,
    "provenance": {
      "source_hash": "2ba84bf061fa6ac81436dc6fa05308bedaedb75f819183d985932ea587a71098",
      "source_ref": "UNFCCC/AMS-III.D@v21-0"
    },
    "title": "The project activity shall satisfy the following conditions:"
  },
  {
    "anchor": "projects-that-recover-methane-from-landfills-shall-use-category-iii-g-and-projects-for",
    "id": "S-0006",
    "level": 1,
    "provenance": {
      "source_hash": "2ba84bf061fa6ac81436dc6fa05308bedaedb75f819183d985932ea587a71098",
      "source_ref": "UNFCCC/AMS-III.D@v21-0"
    },
    "title": "Projects that recover methane from landfills shall use category III-G and projects for"
  },
  {
    "anchor": "kt-co2-equivalent-annually",
    "id": "S-0007",
    "level": 1,
    "provenance": {
      "source_hash": "2ba84bf061fa6ac81436dc6fa05308bedaedb75f819183d985932ea587a71098",
      "source_ref": "UNFCCC/AMS-III.D@v21-0"
    },
    "title": "kt CO2 equivalent annually."
  },
  {
    "anchor": "the-project-boundary-is-the-physical-geographical-site-of-the-methane-recovery-facility",
    "id": "S-0008",
    "level": 1,
    "provenance": {
      "source_hash": "2ba84bf061fa6ac81436dc6fa05308bedaedb75f819183d985932ea587a71098",
      "source_ref": "UNFCCC/AMS-III.D@v21-0"
    },
    "title": "The project boundary is the physical, geographical site of the methane recovery facility."
  },
  {
    "anchor": "project-emissions-consist-of-co2-emissions-from-use-of-fossil-fuels-or-electricity-for-the",
    "id": "S-0009",
    "level": 1,
    "provenance": {
      "source_hash": "2ba84bf061fa6ac81436dc6fa05308bedaedb75f819183d985932ea587a71098",
      "source_ref": "UNFCCC/AMS-III.D@v21-0"
    },
    "title": "Project emissions consist of CO2 emissions from use of fossil fuels or electricity for the"
  },
  {
    "anchor": "the-baseline-scenario-is-the-situation-where-in-the-absence-of-the-project-activity-biomass",
    "id": "S-0010",
    "level": 1,
    "provenance": {
      "source_hash": "2ba84bf061fa6ac81436dc6fa05308bedaedb75f819183d985932ea587a71098",
      "source_ref": "UNFCCC/AMS-III.D@v21-0"
    },
    "title": "The baseline scenario is the situation where, in the absence of the project activity, biomass"
  },
  {
    "anchor": "unfccc-ccnucc-2",
    "id": "S-0011",
    "level": 1,
    "provenance": {
      "source_hash": "2ba84bf061fa6ac81436dc6fa05308bedaedb75f819183d985932ea587a71098",
      "source_ref": "UNFCCC/AMS-III.D@v21-0"
    },
    "title": "UNFCCC/CCNUCC"
  },
  {
    "anchor": "eb-33-2",
    "id": "S-0012",
    "level": 1,
    "provenance": {
      "source_hash": "2ba84bf061fa6ac81436dc6fa05308bedaedb75f819183d985932ea587a71098",
      "source_ref": "UNFCCC/AMS-III.D@v21-0"
    },
    "title": "EB 33"
  },
  {
    "anchor": "if-the-recovered-methane-is-used-for-heat-or-electricity-generation-the-corresponding",
    "id": "S-0013",
    "level": 1,
    "provenance": {
      "source_hash": "2ba84bf061fa6ac81436dc6fa05308bedaedb75f819183d985932ea587a71098",
      "source_ref": "UNFCCC/AMS-III.D@v21-0"
    },
    "title": "If the recovered methane is used for heat or electricity generation, the corresponding"
  },
  {
    "anchor": "no-leakage-calculation-is-required",
    "id": "S-0014",
    "level": 1,
    "provenance": {
      "source_hash": "2ba84bf061fa6ac81436dc6fa05308bedaedb75f819183d985932ea587a71098",
      "source_ref": "UNFCCC/AMS-III.D@v21-0"
    },
    "title": "No leakage calculation is required."
  },
  {
    "anchor": "emission-reductions-achieved-by-the-project-activity-in-each-year-will-be-assessed-ex-post",
    "id": "S-0015",
    "level": 1,
    "provenance": {
      "source_hash": "2ba84bf061fa6ac81436dc6fa05308bedaedb75f819183d985932ea587a71098",
      "source_ref": "UNFCCC/AMS-III.D@v21-0"
    },
    "title": "Emission reductions achieved by the project activity in each year will be assessed ex-post"
  },
  {
    "anchor": "the-amount-of-methane-recovered-and-fuelled-or-flared-shall-be-monitored-ex-post-using",
    "id": "S-0016",
    "level": 1,
    "provenance": {
      "source_hash": "2ba84bf061fa6ac81436dc6fa05308bedaedb75f819183d985932ea587a71098",
      "source_ref": "UNFCCC/AMS-III.D@v21-0"
    },
    "title": "The amount of methane recovered and fuelled or flared shall be monitored ex-post, using"
  },
  {
    "anchor": "regular-maintenance-should-ensure-optimal-operation-of-flares-the-flare-efficiency",
    "id": "S-0017",
    "level": 1,
    "provenance": {
      "source_hash": "2ba84bf061fa6ac81436dc6fa05308bedaedb75f819183d985932ea587a71098",
      "source_ref": "UNFCCC/AMS-III.D@v21-0"
    },
    "title": "Regular maintenance should ensure optimal operation of flares. The flare efficiency,"
  },
  {
    "anchor": "the-emission-reduction-achieved-by-the-project-activity-can-be-estimated-ex-ante-in-the",
    "id": "S-0018",
    "level": 1,
    "provenance": {
      "source_hash": "2ba84bf061fa6ac81436dc6fa05308bedaedb75f819183d985932ea587a71098",
      "source_ref": "UNFCCC/AMS-III.D@v21-0"
    },
    "title": "The emission reduction achieved by the project activity can be estimated ex-ante in the"
  },
  {
    "anchor": "unfccc-ccnucc-3",
    "id": "S-0019",
    "level": 1,
    "provenance": {
      "source_hash": "2ba84bf061fa6ac81436dc6fa05308bedaedb75f819183d985932ea587a71098",
      "source_ref": "UNFCCC/AMS-III.D@v21-0"
    },
    "title": "UNFCCC/CCNUCC"
  },
  {
    "anchor": "eb-33-3",
    "id": "S-0020",
    "level": 1,
    "provenance": {
      "source_hash": "2ba84bf061fa6ac81436dc6fa05308bedaedb75f819183d985932ea587a71098",
      "source_ref": "UNFCCC/AMS-III.D@v21-0"
    },
    "title": "EB 33"
  },
  {
    "anchor": "the-method-for-integration-of-the-terms-in-equation-above-to-obtain-the-results-for-one-year",
    "id": "S-0021",
    "level": 1,
    "provenance": {
      "source_hash": "2ba84bf061fa6ac81436dc6fa05308bedaedb75f819183d985932ea587a71098",
      "source_ref": "UNFCCC/AMS-III.D@v21-0"
    },
    "title": "The method for integration of the terms in equation above to obtain the results for one year"
  },
  {
    "anchor": "flow-meters-sampling-devices-and-gas-analysers-shall-be-subject-to-regular-maintenance",
    "id": "S-0022",
    "level": 1,
    "provenance": {
      "source_hash": "2ba84bf061fa6ac81436dc6fa05308bedaedb75f819183d985932ea587a71098",
      "source_ref": "UNFCCC/AMS-III.D@v21-0"
    },
    "title": "Flow meters, sampling devices and gas analysers shall be subject to regular maintenance,"
  },
  {
    "anchor": "the-proper-soil-application-not-resulting-in-methane-emissions-of-the-final-sludge-must-be",
    "id": "S-0023",
    "level": 1,
    "provenance": {
      "source_hash": "2ba84bf061fa6ac81436dc6fa05308bedaedb75f819183d985932ea587a71098",
      "source_ref": "UNFCCC/AMS-III.D@v21-0"
    },
    "title": "The proper soil application (not resulting in methane emissions) of the final sludge must be"
  },
  {
    "anchor": "the-monitoring-plan-should-include-on-site-inspections-for-each-individual-farm-included-in",
    "id": "S-0024",
    "level": 1,
    "provenance": {
      "source_hash": "2ba84bf061fa6ac81436dc6fa05308bedaedb75f819183d985932ea587a71098",
      "source_ref": "UNFCCC/AMS-III.D@v21-0"
    },
    "title": "The monitoring plan should include on site inspections for each individual farm included in"
  },
  {
    "anchor": "unfccc-ccnucc-4",
    "id": "S-0025",
    "level": 1,
    "provenance": {
      "source_hash": "2ba84bf061fa6ac81436dc6fa05308bedaedb75f819183d985932ea587a71098",
      "source_ref": "UNFCCC/AMS-III.D@v21-0"
    },
    "title": "UNFCCC/CCNUCC"
  },
  {
    "anchor": "eb-33-4",
    "id": "S-0026",
    "level": 1,
    "provenance": {
      "source_hash": "2ba84bf061fa6ac81436dc6fa05308bedaedb75f819183d985932ea587a71098",
      "source_ref": "UNFCCC/AMS-III.D@v21-0"
    },
    "title": "EB 33"
  },
  {
    "anchor": "in-case-the-project-activity-involves-the-replacement-of-equipment-and-the-leakage-effect-of",
    "id": "S-0027",
    "level": 1,
    "provenance": {
      "source_hash": "2ba84bf061fa6ac81436dc6fa05308bedaedb75f819183d985932ea587a71098",
      "source_ref": "UNFCCC/AMS-III.D@v21-0"
    },
    "title": "In case the project activity involves the replacement of equipment, and the leakage effect of"
  }
]
