[
  {
    "anchor": "scope-and-applicability",
    "id": "S-1",
    "provenance": {
      "source_hash": "8505376f7987ae68159db4c570a3daab136432a05112e406c46aa83653d7040a",
      "source_ref": "UNFCCC/AR-AM0014@v01-0-0"
    },
    "section_number": "1",
    "stable_id": "UNFCCC.Forestry.AR-AM0014.v01-0-0.S-1",
    "title": "Scope and applicability"
  },
  {
    "anchor": "baseline-scenario-and-leakage-considerations",
    "id": "S-2",
    "provenance": {
      "source_hash": "8505376f7987ae68159db4c570a3daab136432a05112e406c46aa83653d7040a",
      "source_ref": "UNFCCC/AR-AM0014@v01-0-0"
    },
    "section_number": "2",
    "stable_id": "UNFCCC.Forestry.AR-AM0014.v01-0-0.S-2",
    "title": "Baseline scenario and leakage considerations"
  },
  {
    "anchor": "project-scenario-and-carbon-accounting",
    "id": "S-3",
    "provenance": {
      "source_hash": "8505376f7987ae68159db4c570a3daab136432a05112e406c46aa83653d7040a",
      "source_ref": "UNFCCC/AR-AM0014@v01-0-0"
    },
    "section_number": "3",
    "stable_id": "UNFCCC.Forestry.AR-AM0014.v01-0-0.S-3",
    "title": "Project scenario and carbon accounting"
  },
  {
    "anchor": "leakage-assessment-and-mitigation",
    "id": "S-4",
    "provenance": {
      "source_hash": "8505376f7987ae68159db4c570a3daab136432a05112e406c46aa83653d7040a",
      "source_ref": "UNFCCC/AR-AM0014@v01-0-0"
    },
    "section_number": "4",
    "stable_id": "UNFCCC.Forestry.AR-AM0014.v01-0-0.S-4",
    "title": "Leakage assessment and mitigation"
  },
  {
    "anchor": "monitoring-qa-qc-and-reporting",
    "id": "S-5",
    "provenance": {
      "source_hash": "8505376f7987ae68159db4c570a3daab136432a05112e406c46aa83653d7040a",
      "source_ref": "UNFCCC/AR-AM0014@v01-0-0"
    },
    "section_number": "5",
    "stable_id": "UNFCCC.Forestry.AR-AM0014.v01-0-0.S-5",
    "title": "Monitoring, QA/QC, and reporting"
  }
]
