[
  {
    "anchor": "scope-and-applicability",
    "id": "S-1",
    "provenance": {
      "source_hash": "d776d0979de7e14f1a038e9e54f023d12daafce464849286281fe2539309703a",
      "source_ref": "GoldStandard/GS-00XX@v1-0"
    },
    "section_number": "1",
    "stable_id": "GoldStandard.LUF.GS-00XX.v1-0.S-1",
    "summary": "Defines the LUF Requirements as part of the Gold Standard certification pathway and links them to the core principles and product requirements.",
    "title": "Scope and Applicability",
    "workflow_role": "Entry-point scope and governing-document linkage."
  },
  {
    "anchor": "general-eligibility-criteria",
    "id": "S-2",
    "provenance": {
      "source_hash": "d776d0979de7e14f1a038e9e54f023d12daafce464849286281fe2539309703a",
      "source_ref": "GoldStandard/GS-00XX@v1-0"
    },
    "section_number": "2",
    "stable_id": "GoldStandard.LUF.GS-00XX.v1-0.S-2",
    "summary": "Sets the main project eligibility gates, including activity types, rights and permits, area expansion, and double-counting treatment.",
    "title": "General Eligibility Criteria",
    "workflow_role": "Upfront eligibility and legal-rights screening."
  },
  {
    "anchor": "eligibility-principles",
    "id": "S-3",
    "provenance": {
      "source_hash": "d776d0979de7e14f1a038e9e54f023d12daafce464849286281fe2539309703a",
      "source_ref": "GoldStandard/GS-00XX@v1-0"
    },
    "section_number": "3",
    "stable_id": "GoldStandard.LUF.GS-00XX.v1-0.S-3",
    "summary": "Covers the substantive safeguards and operating requirements around safeguarding, biodiversity, consultation, additionality, and verification cadence.",
    "title": "Eligibility Principles and Requirements",
    "workflow_role": "Substantive safeguards and ongoing compliance controls."
  },
  {
    "anchor": "technical-requirements",
    "id": "S-4",
    "provenance": {
      "source_hash": "d776d0979de7e14f1a038e9e54f023d12daafce464849286281fe2539309703a",
      "source_ref": "GoldStandard/GS-00XX@v1-0"
    },
    "section_number": "4",
    "stable_id": "GoldStandard.LUF.GS-00XX.v1-0.S-4",
    "summary": "Specifies the geospatial and mapping evidence needed to define the project footprint and related technical boundaries.",
    "title": "Technical Requirements",
    "workflow_role": "Technical evidence package for mapping and delineation."
  },
  {
    "anchor": "uncertainty",
    "id": "S-5",
    "provenance": {
      "source_hash": "d776d0979de7e14f1a038e9e54f023d12daafce464849286281fe2539309703a",
      "source_ref": "GoldStandard/GS-00XX@v1-0"
    },
    "section_number": "A",
    "stable_id": "GoldStandard.LUF.GS-00XX.v1-0.S-5",
    "summary": "Defines how uncertainty must be assessed and how deductions affect issuance when the precision target is missed.",
    "title": "Uncertainty of LUF Parameters",
    "workflow_role": "Quantification QA and issuance adjustment rules."
  }
]
