[
  {
    "anchor": "scope-and-boundary",
    "id": "S-1",
    "provenance": {
      "source_hash": "fd7055a353565cb3f510758bf56147923268d6805571dbdf3884e1952c1bf75e",
      "source_ref": "UNFCCC/AR-ACM0003@v02-0"
    },
    "section_number": "1",
    "stable_id": "UNFCCC.Forestry.AR-ACM0003.v02-0.S-1",
    "title": "Scope and boundary"
  },
  {
    "anchor": "baseline-and-additionality",
    "id": "S-2",
    "provenance": {
      "source_hash": "fd7055a353565cb3f510758bf56147923268d6805571dbdf3884e1952c1bf75e",
      "source_ref": "UNFCCC/AR-ACM0003@v02-0"
    },
    "section_number": "2",
    "stable_id": "UNFCCC.Forestry.AR-ACM0003.v02-0.S-2",
    "title": "Baseline and additionality"
  },
  {
    "anchor": "project-emissions-and-removals",
    "id": "S-3",
    "provenance": {
      "source_hash": "fd7055a353565cb3f510758bf56147923268d6805571dbdf3884e1952c1bf75e",
      "source_ref": "UNFCCC/AR-ACM0003@v02-0"
    },
    "section_number": "3",
    "stable_id": "UNFCCC.Forestry.AR-ACM0003.v02-0.S-3",
    "title": "Project emissions and removals"
  },
  {
    "anchor": "leakage-and-displacement-risks",
    "id": "S-4",
    "provenance": {
      "source_hash": "fd7055a353565cb3f510758bf56147923268d6805571dbdf3884e1952c1bf75e",
      "source_ref": "UNFCCC/AR-ACM0003@v02-0"
    },
    "section_number": "4",
    "stable_id": "UNFCCC.Forestry.AR-ACM0003.v02-0.S-4",
    "title": "Leakage and displacement risks"
  },
  {
    "anchor": "monitoring-data-and-reporting",
    "id": "S-5",
    "provenance": {
      "source_hash": "fd7055a353565cb3f510758bf56147923268d6805571dbdf3884e1952c1bf75e",
      "source_ref": "UNFCCC/AR-ACM0003@v02-0"
    },
    "section_number": "5",
    "stable_id": "UNFCCC.Forestry.AR-ACM0003.v02-0.S-5",
    "title": "Monitoring, data, and reporting"
  }
]
