[
  {
    "anchor": "unfccc-ccnucc",
    "id": "S-0001",
    "level": 1,
    "provenance": {
      "source_hash": "c84f1328773b0784e0eefc3511048bfed3d420e71cb2d6e59325f9d973ca3ce5",
      "source_ref": "UNFCCC/AMS-III.D@v21-0"
    },
    "title": "UNFCCC/CCNUCC"
  },
  {
    "anchor": "may-2006",
    "id": "S-0002",
    "level": 1,
    "provenance": {
      "source_hash": "c84f1328773b0784e0eefc3511048bfed3d420e71cb2d6e59325f9d973ca3ce5",
      "source_ref": "UNFCCC/AMS-III.D@v21-0"
    },
    "title": "May 2006"
  },
  {
    "anchor": "type-iii-other-project-activities",
    "id": "S-0003",
    "level": 1,
    "provenance": {
      "source_hash": "c84f1328773b0784e0eefc3511048bfed3d420e71cb2d6e59325f9d973ca3ce5",
      "source_ref": "UNFCCC/AMS-III.D@v21-0"
    },
    "title": "TYPE III - OTHER PROJECT ACTIVITIES"
  },
  {
    "anchor": "this-project-category-comprises-methane-recovery-from-coalmines-agro-industries-and-other",
    "id": "S-0004",
    "level": 1,
    "provenance": {
      "source_hash": "c84f1328773b0784e0eefc3511048bfed3d420e71cb2d6e59325f9d973ca3ce5",
      "source_ref": "UNFCCC/AMS-III.D@v21-0"
    },
    "title": "This project category comprises methane recovery from coalmines, agro-industries, and other"
  },
  {
    "anchor": "co2-emissions-from-combustion-of-non-biogenic-methane-shall-be-accounted-for-in-the-project",
    "id": "S-0005",
    "level": 1,
    "provenance": {
      "source_hash": "c84f1328773b0784e0eefc3511048bfed3d420e71cb2d6e59325f9d973ca3ce5",
      "source_ref": "UNFCCC/AMS-III.D@v21-0"
    },
    "title": "CO2 emissions from combustion of non-biogenic methane shall be accounted for in the project"
  },
  {
    "anchor": "this-category-is-applicable-for-project-activities-resulting-in-annual-emission-reductions-lower-than",
    "id": "S-0006",
    "level": 1,
    "provenance": {
      "source_hash": "c84f1328773b0784e0eefc3511048bfed3d420e71cb2d6e59325f9d973ca3ce5",
      "source_ref": "UNFCCC/AMS-III.D@v21-0"
    },
    "title": "This category is applicable for project activities resulting in annual emission reductions lower than"
  },
  {
    "anchor": "the-project-boundary-is-the-physical-geographical-site-of-the-methane-recovery-facility",
    "id": "S-0007",
    "level": 1,
    "provenance": {
      "source_hash": "c84f1328773b0784e0eefc3511048bfed3d420e71cb2d6e59325f9d973ca3ce5",
      "source_ref": "UNFCCC/AMS-III.D@v21-0"
    },
    "title": "The project boundary is the physical, geographical site of the methane recovery facility."
  },
  {
    "anchor": "the-emission-baseline-is-the-amount-of-methane-that-would-be-emitted-to-the-atmosphere-during",
    "id": "S-0008",
    "level": 1,
    "provenance": {
      "source_hash": "c84f1328773b0784e0eefc3511048bfed3d420e71cb2d6e59325f9d973ca3ce5",
      "source_ref": "UNFCCC/AMS-III.D@v21-0"
    },
    "title": "The emission baseline is the amount of methane that would be emitted to the atmosphere during"
  },
  {
    "anchor": "the-baseline-shall-cover-only-the-capture-and-flaring-that-would-not-have-happened-in-the-absence",
    "id": "S-0009",
    "level": 1,
    "provenance": {
      "source_hash": "c84f1328773b0784e0eefc3511048bfed3d420e71cb2d6e59325f9d973ca3ce5",
      "source_ref": "UNFCCC/AMS-III.D@v21-0"
    },
    "title": "The baseline shall cover only the capture and flaring that would not have happened in the absence"
  },
  {
    "anchor": "in-the-case-of-landfill-gas-waste-gas-waste-water-treatment-and-agro-industries-projects-if-the",
    "id": "S-0010",
    "level": 1,
    "provenance": {
      "source_hash": "c84f1328773b0784e0eefc3511048bfed3d420e71cb2d6e59325f9d973ca3ce5",
      "source_ref": "UNFCCC/AMS-III.D@v21-0"
    },
    "title": "In the case of landfill gas, waste gas, waste water treatment and agro-industries projects: If the"
  },
  {
    "anchor": "no-leakage-calculation-is-required",
    "id": "S-0011",
    "level": 1,
    "provenance": {
      "source_hash": "c84f1328773b0784e0eefc3511048bfed3d420e71cb2d6e59325f9d973ca3ce5",
      "source_ref": "UNFCCC/AMS-III.D@v21-0"
    },
    "title": "No leakage calculation is required."
  },
  {
    "anchor": "unfccc-ccnucc-2",
    "id": "S-0012",
    "level": 1,
    "provenance": {
      "source_hash": "c84f1328773b0784e0eefc3511048bfed3d420e71cb2d6e59325f9d973ca3ce5",
      "source_ref": "UNFCCC/AMS-III.D@v21-0"
    },
    "title": "UNFCCC/CCNUCC"
  },
  {
    "anchor": "may-2006-2",
    "id": "S-0013",
    "level": 1,
    "provenance": {
      "source_hash": "c84f1328773b0784e0eefc3511048bfed3d420e71cb2d6e59325f9d973ca3ce5",
      "source_ref": "UNFCCC/AMS-III.D@v21-0"
    },
    "title": "May 2006"
  },
  {
    "anchor": "the-amount-of-methane-recovered-and-used-as-fuel-or-combusted-shall-be-monitored-using-flow",
    "id": "S-0014",
    "level": 1,
    "provenance": {
      "source_hash": "c84f1328773b0784e0eefc3511048bfed3d420e71cb2d6e59325f9d973ca3ce5",
      "source_ref": "UNFCCC/AMS-III.D@v21-0"
    },
    "title": "The amount of methane recovered and used as fuel or combusted shall be monitored, using flow"
  },
  {
    "anchor": "regular-maintenance-should-ensure-optimal-operation-of-flares-the-flare-efficiency-defined-as",
    "id": "S-0015",
    "level": 1,
    "provenance": {
      "source_hash": "c84f1328773b0784e0eefc3511048bfed3d420e71cb2d6e59325f9d973ca3ce5",
      "source_ref": "UNFCCC/AMS-III.D@v21-0"
    },
    "title": "Regular maintenance should ensure optimal operation of flares. The flare efficiency, defined as"
  },
  {
    "anchor": "flow-meters-sampling-devices-and-gas-analysers-shall-be-subject-to-regular-maintenance-testing",
    "id": "S-0016",
    "level": 1,
    "provenance": {
      "source_hash": "c84f1328773b0784e0eefc3511048bfed3d420e71cb2d6e59325f9d973ca3ce5",
      "source_ref": "UNFCCC/AMS-III.D@v21-0"
    },
    "title": "Flow meters, sampling devices and gas analysers shall be subject to regular maintenance, testing"
  }
]
