[
  {
    "anchor": "type-iii-other-project-activities",
    "id": "S-0001",
    "level": 1,
    "provenance": {
      "source_hash": "fac7861c0f446e1c64f5c81f7001363785ba7931dbf13e0b7b8a4637bcc57357",
      "source_ref": "UNFCCC/AMS-III.D@v21-0"
    },
    "title": "TYPE III - OTHER PROJECT ACTIVITIES"
  },
  {
    "anchor": "this-project-category-comprises-methane-recovery-from-coalmines-agro-industries-landfills",
    "id": "S-0002",
    "level": 1,
    "provenance": {
      "source_hash": "fac7861c0f446e1c64f5c81f7001363785ba7931dbf13e0b7b8a4637bcc57357",
      "source_ref": "UNFCCC/AMS-III.D@v21-0"
    },
    "title": "This project category comprises methane recovery from coalmines, agro-industries, landfills,"
  },
  {
    "anchor": "co2-emissions-from-combustion-of-non-biogenic-methane-shall-be-accounted-for-in-the-project",
    "id": "S-0003",
    "level": 1,
    "provenance": {
      "source_hash": "fac7861c0f446e1c64f5c81f7001363785ba7931dbf13e0b7b8a4637bcc57357",
      "source_ref": "UNFCCC/AMS-III.D@v21-0"
    },
    "title": "CO2 emissions from combustion of non-biogenic methane shall be accounted for in the project"
  },
  {
    "anchor": "the-project-boundary-is-the-physical-geographical-site-of-the-methane-recovery-facility",
    "id": "S-0004",
    "level": 1,
    "provenance": {
      "source_hash": "fac7861c0f446e1c64f5c81f7001363785ba7931dbf13e0b7b8a4637bcc57357",
      "source_ref": "UNFCCC/AMS-III.D@v21-0"
    },
    "title": "The project boundary is the physical, geographical site of the methane recovery facility."
  },
  {
    "anchor": "the-emission-baseline-is-the-amount-of-methane-that-would-be-emitted-to-the-atmosphere-during-the",
    "id": "S-0005",
    "level": 1,
    "provenance": {
      "source_hash": "fac7861c0f446e1c64f5c81f7001363785ba7931dbf13e0b7b8a4637bcc57357",
      "source_ref": "UNFCCC/AMS-III.D@v21-0"
    },
    "title": "The emission baseline is the amount of methane that would be emitted to the atmosphere during the"
  },
  {
    "anchor": "the-baseline-shall-cover-only-the-capture-and-flaring-that-would-not-have-happened-in-the-absence-of",
    "id": "S-0006",
    "level": 1,
    "provenance": {
      "source_hash": "fac7861c0f446e1c64f5c81f7001363785ba7931dbf13e0b7b8a4637bcc57357",
      "source_ref": "UNFCCC/AMS-III.D@v21-0"
    },
    "title": "The baseline shall cover only the capture and flaring that would not have happened in the absence of"
  },
  {
    "anchor": "in-the-case-of-landfill-gas-waste-gas-waste-water-treatment-and-agro-industries-projects-if-the",
    "id": "S-0007",
    "level": 1,
    "provenance": {
      "source_hash": "fac7861c0f446e1c64f5c81f7001363785ba7931dbf13e0b7b8a4637bcc57357",
      "source_ref": "UNFCCC/AMS-III.D@v21-0"
    },
    "title": "In the case of landfill gas, waste gas, waste water treatment and agro-industries projects: If the"
  },
  {
    "anchor": "no-leakage-calculation-is-required",
    "id": "S-0008",
    "level": 1,
    "provenance": {
      "source_hash": "fac7861c0f446e1c64f5c81f7001363785ba7931dbf13e0b7b8a4637bcc57357",
      "source_ref": "UNFCCC/AMS-III.D@v21-0"
    },
    "title": "No leakage calculation is required."
  },
  {
    "anchor": "the-amount-of-methane-recovered-and-used-as-fuel-or-combusted-shall-be-monitored-using-flow",
    "id": "S-0009",
    "level": 1,
    "provenance": {
      "source_hash": "fac7861c0f446e1c64f5c81f7001363785ba7931dbf13e0b7b8a4637bcc57357",
      "source_ref": "UNFCCC/AMS-III.D@v21-0"
    },
    "title": "The amount of methane recovered and used as fuel or combusted shall be monitored, using flow"
  },
  {
    "anchor": "regular-maintenance-should-ensure-optimal-operation-of-flares-the-flare-efficiency-defined-as-the",
    "id": "S-0010",
    "level": 1,
    "provenance": {
      "source_hash": "fac7861c0f446e1c64f5c81f7001363785ba7931dbf13e0b7b8a4637bcc57357",
      "source_ref": "UNFCCC/AMS-III.D@v21-0"
    },
    "title": "Regular maintenance should ensure optimal operation of flares. The flare efficiency, defined as the"
  },
  {
    "anchor": "flow-meters-sampling-devices-and-gas-analysers-shall-be-subject-to-regular-maintenance-testing",
    "id": "S-0011",
    "level": 1,
    "provenance": {
      "source_hash": "fac7861c0f446e1c64f5c81f7001363785ba7931dbf13e0b7b8a4637bcc57357",
      "source_ref": "UNFCCC/AMS-III.D@v21-0"
    },
    "title": "Flow meters, sampling devices and gas analysers shall be subject to regular maintenance, testing"
  }
]
